Table,Field,Description
Charity,organisation_number,The organisation number for the charity. This is the index value for the charity.
Charity,registered_charity_number,The registration number of the registered organisation allocated by the Commission. Note that a main charity and all its linked charities will share the same registered_charity_number.
Charity,linked_charity_number,A number that uniquely identifies the subsidiary or group member associated with a registered charity. Used for user identification purposes where the subsidiary is known by the parent registration number and the subsidiary number. The main parent charity has a linked_charity_number of 0.
Charity,charity_name,The Main Name of the Charity
Charity,charity_type,The type of the charity displayed on the public register of charities. Only the main parent charity will have a value for this field (i.e. linked_charity_number=0).
Charity,charity_registration_status,The charity registration status indicates whether a charity is registered or removed
Charity,date_of_registration,The date the charity was registered with the Charity Commission.
Charity,date_of_removal,This is the date the charity was removed from the Register of Charities. This will not necessarily be the same date that the charity ceased to exist or ceased to operate. For non-removed charities the field is NULL.
Charity,charity_reporting_status,The current reporting status of the charity
Charity,latest_acc_fin_period_start_date,The start date of the latest financial period for which the charity has made a submission.
Charity,latest_acc_fin_period_end_date,The end date of the latest financial period for which the charity has made a submission.
Charity,latest_income,The latest income submitted by the charity. This is the total gross income submitted on part A of the annual return submission.
Charity,latest_expenditure,The latest expenditure submitted by a charity. This is the expenditure submitted on part A of the annual return submission.
Charity,charity_contact_address1,Charity Address Line 1
Charity,charity_contact_address2,Charity Address Line 2
Charity,charity_contact_address3,Charity Address Line 3
Charity,charity_contact_address4,Charity Address Line 4
Charity,charity_contact_address5,Charity Address Line 5
Charity,charity_contact_postcode,Charity Postcode
Charity,charity_contact_phone,Charity Public Telephone Number
Charity,charity_contact_email,Charity Public email address
Charity,charity_contact_web,Charity Website Address
Charity,charity_company_registration_number,Registered Company Number of the Charity as assigned by Companies House. Integer returned as string
Charity,charity_insolvent,Indicates if the charity is insolvent.
Charity,charity_in_administration,Indicates if the charity is in administration.
Charity,charity_previously_excepted,Indicates the charity was previously an excepted charity.
Charity,charity_is_cdf_or_cif,Indicates whether the charity is a Common Investment Fund or Common Deposit Fund.
Charity,charity_is_cio,Indicates whether the charity is a Charitable Incorporated Organisation.
Charity,cio_is_dissolved,Indicates the CIO is to be dissolved.
Charity,date_cio_dissolution_notice,Date the CIO dissolution notice expires
Charity,charity_activities,"The charity activities, the trustees' description of what they do and who they help."
Charity,charity_gift_aid,"Indicates whether the charity is registered for gift aid with HMRC. True, False, NULL (not known)"
Charity,charity_has_land,"Indicates whether the charity owns or leases any land or buildings. True, False, NULL (not known)"
CharityAnnualReturnHistory,organisation_number,The organisation number for the charity. This is the index value for the charity.
CharityAnnualReturnHistory,registered_charity_number,The registration number of the registered organisation allocated by the Commission. Note that a main charity and all its linked charities will share the same registered_charity_number.
CharityAnnualReturnHistory,fin_period_start_date,The start date of the financial period which is detailed for the charity.
CharityAnnualReturnHistory,fin_period_end_date,The end date of the financial period which is detailed for the charity.
CharityAnnualReturnHistory,ar_cycle_reference,The annual return cycle to which the submission details relate.
CharityAnnualReturnHistory,reporting_due_date,The due date of the financial period which is detailed for the charity.
CharityAnnualReturnHistory,date_annual_return_received,The date the annual return was received for the financial period which is detailed for the charity.
CharityAnnualReturnHistory,date_accounts_received,The date the charity accounts were received for the financial period which is detailed for the charity.
CharityAnnualReturnHistory,total_gross_income,The total gross income reported on Part A of the annual return for the financial period detailed.
CharityAnnualReturnHistory,total_gross_expenditure,The total gross expenditure reported on Part A of the annual return for the financial period detailed.
CharityAnnualReturnHistory,accounts_qualified,Indicates whether the accounts have a qualified opinion. (True or NULL)
CharityAnnualReturnHistory,suppression_ind,"An indicator of whether the finances for this year are currently suppressed. 1 = Supressed, 0 = not supressed."
CharityAnnualReturnHistory,suppression_type,
CharityAreaOfOperation,organisation_number,The organisation number for the charity. This is the index value for the charity.
CharityAreaOfOperation,registered_charity_number,The registration number of the registered organisation allocated by the Commission. Note that a main charity and all its linked charities will share the same registered_charity_number.
CharityAreaOfOperation,linked_charity_number,A number that uniquely identifies the subsidiary or group member associated with a registered charity. Used for user identification purposes where the subsidiary is known by the parent registration number and the subsidiary number. The main parent charity has a linked_charity_number of 0.
CharityAreaOfOperation,geographic_area_type,The area type for this row
CharityAreaOfOperation,geographic_area_description,The area descriptor for this row
CharityAreaOfOperation,parent_geographic_area_type,"The parent area type. For example, if the area type is a country this indicator will be continent"
CharityAreaOfOperation,parent_geographic_area_description,The descriptor for the parent area type
CharityAreaOfOperation,welsh_ind,
CharityARPartA,organisation_number,The organisation number for the charity. This is the index value for the charity.
CharityARPartA,registered_charity_number,The registration number of the registered organisation allocated by the Commission. Note that a main charity and all its linked charities will share the same registered_charity_number.
CharityARPartA,latest_fin_period_submitted_ind,Indicates whether the financial data on this line relates to the latest financial data submitted by the charity. (True or False)
CharityARPartA,fin_period_order_number,"A field to aid ordering of the financial data for each charity. (1=Most recent data in the table, 5=Least recent data in the table)"
CharityARPartA,ar_cycle_reference,The annual return cycle to which the submission details relate.
CharityARPartA,fin_period_start_date,The start date of the financial period which is detailed for the charity.
CharityARPartA,fin_period_end_date,The end date of the financial period which is detailed for the charity.
CharityARPartA,ar_due_date,The due date of the annual return which is detailed for the charity.
CharityARPartA,ar_received_date,The date the annual return was received for the financial period which is detailed for the charity.
CharityARPartA,total_gross_income,The total gross income reported on Part A of the annual return for the financial period detailed.
CharityARPartA,total_gross_expenditure,The total gross expenditure reported on Part A of the annual return for the financial period detailed.
CharityARPartA,charity_raises_funds_from_public,"Indicates if the charity raised funds from the public for the financial period which is detailed for the charity. (True, False or NULL)"
CharityARPartA,charity_professional_fundraiser,"Indicates if the charity worked with professional fundraisers for the financial period which is detailed for the charity. (True, False or NULL)"
CharityARPartA,charity_agreement_professional_fundraiser,"Indicates if the charity had an agreement with its professional fundraisers for the financial period which is detailed. (True, False or NULL)"
CharityARPartA,charity_commercial_participator,"Indicates if the charity worked with commercial participators for the financial period detailed. (True, False or NULL)"
CharityARPartA,charity_agreement_commerical_participator,"Indicates if the charity had an agreement with its commercial participators for the financial period detailed. (True, False or NULL)"
CharityARPartA,grant_making_is_main_activity,"Indicates if grant making was the main way the charity carried out its purposes for the financial period detailed. (True, False or NULL)"
CharityARPartA,charity_receives_govt_funding_contracts,"Indicates if the charity received any income from government contracts for the financial period detailed. (True, False or NULL)"
CharityARPartA,count_govt_contracts,The number of government contracts the charity had for the financial period detailed.
CharityARPartA,charity_receives_govt_funding_grants,"Indicates if the charity received any income from government grants for the financial period detailed. (True, False or NULL)"
CharityARPartA,count_govt_grants,The number of government grants the charity received for the financial period detailed.
CharityARPartA,income_from_government_contracts,The income the charity received from government contracts for the financial period detailed.
CharityARPartA,income_from_government_grants,The income the charity received from government grants for the financial period detailed.
CharityARPartA,charity_has_trading_subsidiary,"Indicates if the charity had a trading subsidiary for the financial period detailed. (True, False or NULL)"
CharityARPartA,trustee_also_director_of_subsidiary,"Indicates if a trustee was also a director of a trading subsidiary for the financial period detailed. (True, False or NULL)"
CharityARPartA,does_trustee_receive_any_benefit,"Indicates if any of the trustees received any remuneration, payments or benefits from the charity other than refunds of legitimate trustee expenses for the financial period detailed. (True, False or NULL)"
CharityARPartA,trustee_payments_acting_as_trustee,"Indicates if any trustees received payments for acting as a trustee for the financial period detailed. (True, False or NULL)"
CharityARPartA,trustee_receives_payments_services,"Indicates if any trustees received payments for providing services to the charity for the financial period detailed. (True, False or NULL)"
CharityARPartA,trustee_receives_other_benefit,"Indicates if any trustees received any other benefit from the charity for the financial period detailed. (True, False or NULL)"
CharityARPartA,trustee_resigned_employment,"Indicates if any of the trustees resigned and took up employment with the charity during the financial period detailed. (True, False or NULL)"
CharityARPartA,employees_salary_over_60k,"Indicates if any of the charity's staff received total employee benefits of £60,000 or more. (True, False or NULL)"
CharityARPartA,count_salary_band_60001_70000,Number of staff whose total employment benefits were in this band for the financial period detailed.
CharityARPartA,count_salary_band_70001_80000,Number of staff whose total employment benefits were in this band for the financial period detailed.
CharityARPartA,count_salary_band_80001_90000,Number of staff whose total employment benefits were in this band for the financial period detailed.
CharityARPartA,count_salary_band_90001_100000,Number of staff whose total employment benefits were in this band for the financial period detailed.
CharityARPartA,count_salary_band_100001_110000,Number of staff whose total employment benefits were in this band for the financial period detailed.
CharityARPartA,count_salary_band_110001_120000,Number of staff whose total employment benefits were in this band for the financial period detailed.
CharityARPartA,count_salary_band_120001_130000,Number of staff whose total employment benefits were in this band for the financial period detailed.
CharityARPartA,count_salary_band_130001_140000,Number of staff whose total employment benefits were in this band for the financial period detailed.
CharityARPartA,count_salary_band_140001_150000,Number of staff whose total employment benefits were in this band for the financial period detailed.
CharityARPartA,count_salary_band_150001_200000,Number of staff whose total employment benefits were in this band for the financial period detailed.
CharityARPartA,count_salary_band_200001_250000,Number of staff whose total employment benefits were in this band for the financial period detailed.
CharityARPartA,count_salary_band_250001_300000,Number of staff whose total employment benefits were in this band for the financial period detailed.
CharityARPartA,count_salary_band_300001_350000,Number of staff whose total employment benefits were in this band for the financial period detailed.
CharityARPartA,count_salary_band_350001_400000,Number of staff whose total employment benefits were in this band for the financial period detailed.
CharityARPartA,count_salary_band_400001_450000,Number of staff whose total employment benefits were in this band for the financial period detailed.
CharityARPartA,count_salary_band_450001_500000,Number of staff whose total employment benefits were in this band for the financial period detailed.
CharityARPartA,count_salary_band_over_500000,Number of staff whose total employment benefits were in this band for the financial period detailed.
CharityARPartA,count_volunteers,"Number of Volunteers. The trustees' estimate of the number of people who undertook voluntary work in the UK for the charity during the year. The number shown is a head count and not expressed as full-time equivalents. Charities are invited to provide an estimate of volunteer numbers in their Annual Return but are not obliged to do so. Where a number is provided by the charity, including zero, that number is displayed."
CharityARPartB,organisation_number,The organisation number for the charity. This is the index value for the charity.
CharityARPartB,registered_charity_number,The registration number of the registered organisation allocated by the Commission. Note that a main charity and all its linked charities will share the same registered_charity_number.
CharityARPartB,latest_fin_period_submitted_ind,Indicates whether the financial data on this line relates to the latest financial data submitted by the charity. (True or False)
CharityARPartB,fin_period_order_number,"A field to aid ordering of the financial data for each charity. (1=Most recent data in the table, 5=Least recent data in the table)"
CharityARPartB,ar_cycle_reference,The annual return cycle to which the submission details relate.
CharityARPartB,fin_period_start_date,The start date of the financial period which is detailed for the charity.
CharityARPartB,fin_period_end_date,The end date of the financial period which is detailed for the charity.
CharityARPartB,ar_due_date,The due date of the annual return which is detailed for the charity.
CharityARPartB,ar_received_date,The date the annual return was received for the financial period which is detailed for the charity.
CharityARPartB,income_donations_and_legacies,Income from donations and legacies as entered on the Annual Return form for the financial period detailed.
CharityARPartB,income_charitable_activities,Income received as fees or grants specifically for goods and services supplied by the charity to meet the needs of its beneficiaries for the financial period detailed.
CharityARPartB,income_other_trading_activities,Income from other trading activity as entered on the Annual Return form for the financial period detailed.
CharityARPartB,income_investments,"Income from investments including dividends, interest and rents but excluding changes (realised and unrealised gains) in the capital value of the investment portfolio for the financial period detailed."
CharityARPartB,income_other,"Other income. This category includes gains on the disposal of own use assets (i.e. fixed assets not held as investments), but otherwise is only used exceptionally for very unusual transactions that cannot be accounted for in the categories above for the financial period detailed."
CharityARPartB,income_total_income_and_endowments,Total income including endowments for the financial period detailed.
CharityARPartB,income_legacies,Income from legacies as entered on the Annual Return form for the financial period detailed.
CharityARPartB,income_endowments,Income from endowments as entered on the Annual Return form for the financial period detailed.
CharityARPartB,expenditure_raising_funds,"Costs associated with providing goods and services to the public, where the main motive is to raise funds for the charity rather than providing goods or services to meet the needs of its beneficiaries for the financial period detailed. (eg charity shops, fundraising dinners etc.)."
CharityARPartB,expenditure_charitable_expenditure,Costs incurred by the charity in supplying goods or services to meet the needs of its beneficiaries. Grants made to meet the needs of the charity's beneficiaries for the financial period detailed.
CharityARPartB,expenditure_other,Other expenditure for the financial period detailed. This category is only used very exceptionally for items that don't fit within one of the categories above.
CharityARPartB,expenditure_total,Total expenditure for the financial period detailed on the Part B of the annual return.
CharityARPartB,expenditure_investment_management,Expenditure managing investments for the financial period detailed.
CharityARPartB,expenditure_grants_institution,Any grants that the charity has awarded to other institutions to further their charitable work.
CharityARPartB,expenditure_governance,"Costs associated with running the charity itself for the financial period. (e.g. costs of trustee meetings, internal and external audit costs and legal advice relating to governance matters)."
CharityARPartB,expenditure_support_costs,"Support costs should be allocated across activities and are those costs which, while necessary to deliver an activity, do not themselves produce the activity.  They include the central office functions of the charity and are often apportioned to activities.  The amount shown here is the total amount of support costs (for charitable, fundraising and governance activities) included in resources expended."
CharityARPartB,expenditure_depreciation,"Depreciation charge for the year can be found in the fixed asset analysis notes to the accounts.  This is the amount of depreciation on tangible fixed assets (including impairment charges, if any), which will be shown as the charge for the year in the tangible fixed asset note to the accounts."
CharityARPartB,gain_loss_investment,The gain or loss associated with the charity's investments
CharityARPartB,gain_loss_pension_fund,The gain or loss associated with the charity's pension fund
CharityARPartB,gain_loss_revaluation_fixed_investment,The gain or loss associated with any revaluation of fixed assets
CharityARPartB,gain_loss_other,The gain or loss associated with any other assets
CharityARPartB,reserves,The level of reserves is those unrestricted funds which are freely available for the charity to spend and can be found in the Financial Review in the Trustees Annual Report and will exclude endowments.
CharityARPartB,assets_total_fixed,"Total fixed assets. Fixed assets are those held for continuing use and include tangible fixed assets such as land, buildings, equipment and vehicles, and any investments held on a long-term basis to generate income or gains."
CharityARPartB,assets_own_use,Total own use assets. This is a calculated field. assets_own_use = assets_total_fixed - assets_long_term_investment
CharityARPartB,assets_long_term_investment,"Fixed Asset Investment are held for the long term to generate income or gains and may include quoted and unquoted shares, bonds, gilts, common investment funds, investment property and term deposits held as part of an investment portfolio."
CharityARPartB,defined_benefit_pension_scheme,This is surplus or deficit in any defined benefit pension scheme operated and represents a potential long-term asset or liability.
CharityARPartB,assets_other_assets,The value of any other assets
CharityARPartB,assets_total_liabilities,The value of the total liabilities for the charity. This is a calculated field. assets_total_liabilities = creditors_one_year_total_current + creditors_falling_due_after_one_year
CharityARPartB,assets_current_investment,Total Current Assets are a separate class of Total Current Asset and they are held with intention of disposing of them within 12 months.
CharityARPartB,assets_total_assets_and_liabilities,Total Net assets or liabilities can be found on the Balance Sheet. This is the total of all assets shown less all liabilities. This should be the same as the Total funds of the charity.
CharityARPartB,creditors_one_year_total_current,"Creditors due within one year are the amounts owed to creditors and include loans and overdrafts, trade creditors, accruals and deferred income and they are payable within one year."
CharityARPartB,creditors_falling_due_after_one_year,"These are the amounts owed to creditors payable after more than one year, with provisions for liabilities and charges."
CharityARPartB,assets_cash,"Cash at bank and in hand are a separate class of Total Current Assets.  This amount includes deposits with banks and other financial institutions, which are repayable on demand, but excludes bank overdrafts."
CharityARPartB,funds_endowment,Endowment funds include the amount of all permanent and expendable endowment funds.
CharityARPartB,funds_unrestricted,"Unrestricted funds include the amount of all funds held for the general purposes of the charity.  This will include unrestricted income funds, designated funds, revaluation reserves and any pension reserve."
CharityARPartB,funds_restricted,Restricted funds include the amount of all funds held that must be spent on the purposes of the charity.
CharityARPartB,funds_total,Total funds can be found on the Balance Sheet and should be the same as Total net assets/(liabilities).
CharityARPartB,count_employees,The number of people that the charity employs
CharityARPartB,charity_only_accounts,Indicates if the accounts represent only the charity accounts
CharityARPartB,consolidated_accounts,Consolidated accounts bring together the resources of the charity and the subsidiaries under its control in one statement. These subsidiaries may be non-charitable and to exist for purposes that benefit the parent charity e.g. fund-raising. If set to 1 the accounts are consolidated.
CharityClassification,organisation_number,The organisation number for the charity. This is the index value for the charity.
CharityClassification,registered_charity_number,The registration number of the registered organisation allocated by the Commission. Note that a main charity and all its linked charities will share the same registered_charity_number.
CharityClassification,linked_charity_number,A number that uniquely identifies the subsidiary or group member associated with a registered charity. Used for user identification purposes where the subsidiary is known by the parent registration number and the subsidiary number. The main parent charity has a linked_charity_number of 0.
CharityClassification,classification_code,The code of the classification described in the row
CharityClassification,classification_type,The type of the classification. What - What the charity does. How - How the charity helps. Who - Who the charity helps
CharityClassification,classification_description,The descriptor of the classification code.
CharityEventHistory,organisation_number,The organisation number for the charity. This is the index value for the charity.
CharityEventHistory,registered_charity_number,The registration number of the registered organisation allocated by the Commission. Note that a main charity and all its linked charities will share the same registered_charity_number.
CharityEventHistory,linked_charity_number,A number that uniquely identifies the subsidiary or group member associated with a registered charity. Used for user identification purposes where the subsidiary is known by the parent registration number and the subsidiary number. The main parent charity has a linked_charity_number of 0.
CharityEventHistory,charity_name,The Main Name of the Charity
CharityEventHistory,charity_event_order,The order of the event in the charity history. 1 is the earliest event.
CharityEventHistory,event_type,The type of charity event that has occurred.
CharityEventHistory,date_of_event,The date that the event occurred.
CharityEventHistory,reason,The reason that the event occurred. A registration event will not have a reason available.
CharityEventHistory,assoc_organisation_number,"The charity id for the charity associated with the charity event. For example, in the case of asset transfer in this is the charity that has transferred the funds into the charity."
CharityEventHistory,assoc_registered_charity_number,"The registered charity number for the charity associated with the charity event. For example, in the case of asset transfer in this is the charity that has transferred the funds into the charity."
