Table,Field,Description
CharityEventHistory,assoc_charity_name,"The charity name of the charity associated with the charity event. For example, in the case of asset transfer in this is the charity that has transferred the funds into the charity."
CharityGoverningDocument,organisation_number,The organisation number for the charity. This is the index value for the charity.
CharityGoverningDocument,registered_charity_number,The registration number of the registered organisation allocated by the Commission. Note that a main charity and all its linked charities will share the same registered_charity_number.
CharityGoverningDocument,linked_charity_number,A number that uniquely identifies the subsidiary or group member associated with a registered charity. Used for user identification purposes where the subsidiary is known by the parent registration number and the subsidiary number. The main parent charity has a linked_charity_number of 0.
CharityGoverningDocument,governing_document_description,The description of the governing document. Note that this is not the governing document itself but the details of the original document and any subsequent amendments.
CharityGoverningDocument,charitable_objects,The charitable objects of the charity.
CharityGoverningDocument,area_of_benefit,The area of benefit of the charity as defined in the governing document. This field can be blank as a charity does not have to define an area of benefit in the governing document.
CharityOtherNames,organisation_number,The organisation number for the charity. This is the index value for the charity.
CharityOtherNames,registered_charity_number,The registration number of the registered organisation allocated by the Commission. Note that a main charity and all its linked charities will share the same registered_charity_number.
CharityOtherNames,linked_charity_number,A number that uniquely identifies the subsidiary or group member associated with a registered charity. Used for user identification purposes where the subsidiary is known by the parent registration number and the subsidiary number. The main parent charity has a linked_charity_number of 0.
CharityOtherNames,charity_name_id,An id for the other charity name
CharityOtherNames,charity_name_type,The type of other charity name. This can be working name or previous name.
CharityOtherNames,charity_name,The Main Name of the Charity
CharityOtherRegulators,organisation_number,The organisation number for the charity. This is the index value for the charity.
CharityOtherRegulators,registered_charity_number,The registration number of the registered organisation allocated by the Commission. Note that a main charity and all its linked charities will share the same registered_charity_number.
CharityOtherRegulators,regulator_order,A field to aid the ordering of the regulators for the charity.
CharityOtherRegulators,regulator_name,The name of the regulator.
CharityOtherRegulators,regulator_web_url,The web URL for the regulator.
CharityPolicy,organisation_number,The organisation number for the charity. This is the index value for the charity.
CharityPolicy,registered_charity_number,The registration number of the registered organisation allocated by the Commission. Note that a main charity and all its linked charities will share the same registered_charity_number.
CharityPolicy,linked_charity_number,A number that uniquely identifies the subsidiary or group member associated with a registered charity. Used for user identification purposes where the subsidiary is known by the parent registration number and the subsidiary number. The main parent charity has a linked_charity_number of 0.
CharityPolicy,policy_name,The name of the policy that the charity has in place.
CharityPublishedReport,organisation_number,The organisation number for the charity. This is the index value for the charity.
CharityPublishedReport,registered_charity_number,The registration number of the registered organisation allocated by the Commission. Note that a main charity and all its linked charities will share the same registered_charity_number.
CharityPublishedReport,linked_charity_number,A number that uniquely identifies the subsidiary or group member associated with a registered charity. Used for user identification purposes where the subsidiary is known by the parent registration number and the subsidiary number. The main parent charity has a linked_charity_number of 0.
CharityPublishedReport,report_name,The type of report that has been published in relation to the charity.
CharityPublishedReport,report_location,The web URL for the location on the charity commission .gov site where the published report can be located.
CharityPublishedReport,date_published,The date that the message on the public register of charities to the report was published.
CharityTrustee,organisation_number,The organisation number for the charity. This is the index value for the charity.
CharityTrustee,registered_charity_number,The registration number of the registered organisation allocated by the Commission. Note that a main charity and all its linked charities will share the same registered_charity_number.
CharityTrustee,linked_charity_number,A number that uniquely identifies the subsidiary or group member associated with a registered charity. Used for user identification purposes where the subsidiary is known by the parent registration number and the subsidiary number. The main parent charity has a linked_charity_number of 0.
CharityTrustee,trustee_id,The id number of the trustee.
CharityTrustee,trustee_name,The name of the trustee.
CharityTrustee,trustee_is_chair,TRUE if the trustee is the Chair. FALSE otherwise.
CharityTrustee,individual_or_organisation,A flag to denote whether the trustee is an individual or an organisation. O for organisation or P for an individual.
CharityTrustee,trustee_date_of_appointment,The date of appointment of the trustee for that charity.
